Release,Title,Year,Rated,Released,Runtime,Genre,Director,Actors,Country,Awards,Rotten Tomatoes,Metascore,IMDB,IMDB Votes,IMDB id,Top100 Year
Bad Boys for Life,Bad Boys for Life,2020,R,17 Jan 2020,124 min,"Action, Comedy, Crime, Thriller","Adil El Arbi, Bilall Fallah","Will Smith, Martin Lawrence, Vanessa Hudgens, Alexander Ludwig","USA, Mexico",2 wins & 14 nominations.,77%,59,6.6,"133,505",tt1502397,2020
1917,1917,2019,R,10 Jan 2020,119 min,"Drama, Thriller, War",Sam Mendes,"Dean-Charles Chapman, George MacKay, Daniel Mays, Colin Firth","USA, UK, India, Spain, Canada, China",Won 3 Oscars. Another 127 wins & 198 nominations.,89%,78,8.3,"442,036",tt8579674,2020
Sonic the Hedgehog,Sonic the Hedgehog,2020,PG,14 Feb 2020,99 min,"Action, Adventure, Comedy, Sci-Fi",Jeff Fowler,"Ben Schwartz, James Marsden, Jim Carrey, Tika Sumpter","USA, Japan, Canada",3 wins & 9 nominations.,63%,47,6.5,"92,987",tt3794354,2020
Jumanji: The Next Level,Jumanji: The Next Level,2019,PG-13,13 Dec 2019,123 min,"Action, Adventure, Comedy, Fantasy",Jake Kasdan,"Dwayne Johnson, Kevin Hart, Jack Black, Karen Gillan",USA,1 win & 10 nominations.,71%,58,6.6,"192,270",tt7975244,2020
Star Wars: Episode IX - The Rise of Skywalker,Star Wars: Episode IX - The Rise of Skywalker,2019,PG-13,20 Dec 2019,141 min,"Action, Adventure, Fantasy, Sci-Fi",J.J. Abrams,"Carrie Fisher, Mark Hamill, Adam Driver, Daisy Ridley",USA,Nominated for 3 Oscars. Another 9 wins & 39 nominations.,51%,53,6.6,"378,434",tt2527338,2020
Birds of Prey,Birds of Prey,2020,R,07 Feb 2020,109 min,"Action, Adventure, Comedy, Crime",Cathy Yan,"Margot Robbie, Rosie Perez, Mary Elizabeth Winstead, Jurnee Smollett",USA,10 wins & 68 nominations.,78%,60,6.1,"173,258",tt7713068,2020
Dolittle,Dolittle,2020,PG,17 Jan 2020,101 min,"Adventure, Comedy, Family, Fantasy",Stephen Gaghan,"Robert Downey Jr., Antonio Banderas, Michael Sheen, Jim Broadbent","USA, China, UK, Japan",1 win & 9 nominations.,14%,26,5.6,"49,731",tt6673612,2020
Little Women,Little Women,2019,PG,25 Dec 2019,135 min,"Drama, Romance",Greta Gerwig,"Saoirse Ronan, Emma Watson, Florence Pugh, Eliza Scanlen",USA,Won 1 Oscar. Another 75 wins & 216 nominations.,95%,91,7.8,"148,920",tt3281548,2020
The Invisible Man,The Invisible Man,2020,R,28 Feb 2020,124 min,"Drama, Horror, Mystery, Sci-Fi, Thriller",Leigh Whannell,"Elisabeth Moss, Oliver Jackson-Cohen, Harriet Dyer, Aldis Hodge","Canada, Australia, USA",30 wins & 64 nominations.,72/100,72,7.1,"172,327",tt1051906,2020
The Call of the Wild,The Call of the Wild,2020,PG,21 Feb 2020,100 min,"Adventure, Drama, Family",Chris Sanders,"Harrison Ford, Omar Sy, Cara Gee, Dan Stevens","Canada, USA",1 win & 7 nominations.,47/100,47,6.8,"39,877",tt7504726,2020
Onward,Onward,2020,PG,06 Mar 2020,102 min,"Animation, Adventure, Comedy, Family, Fantasy",Dan Scanlon,"Tom Holland, Chris Pratt, Julia Louis-Dreyfus, Octavia Spencer",USA,Nominated for 1 Golden Globe. Another 3 wins & 59 nominations.,88%,61,7.4,"105,337",tt7146812,2020
Knives Out,Knives Out,2019,PG-13,27 Nov 2019,130 min,"Comedy, Crime, Drama, Mystery, Thriller",Rian Johnson,"Daniel Craig, Chris Evans, Ana de Armas, Jamie Lee Curtis",USA,Nominated for 1 Oscar. Another 47 wins & 107 nominations.,97%,82,7.9,"471,083",tt8946378,2020
Frozen II,Frozen II,2019,PG,22 Nov 2019,103 min,"Animation, Adventure, Comedy, Family, Fantasy, Musical","Chris Buck, Jennifer Lee","Kristen Bell, Idina Menzel, Josh Gad, Jonathan Groff","USA, Norway",Nominated for 1 Oscar. Another 18 wins & 88 nominations.,78%,64,6.9,"140,131",tt4520988,2020
Tenet,Tenet,2020,PG-13,03 Sep 2020,150 min,"Action, Sci-Fi, Thriller",Christopher Nolan,"Juhan Ulfsak, Jefferson Hall, Ivo Uukkivi, Andrew Howard","UK, USA",Nominated for 2 Oscars. Another 34 wins & 122 nominations.,70%,69,7.5,"311,857",tt6723592,2020
Spies in Disguise,Spies in Disguise,2019,PG,25 Dec 2019,102 min,"Animation, Action, Adventure, Comedy, Family, Sci-Fi","Nick Bruno, Troy Quane","Rachel Brosnahan, Jarrett Bruno, Claire Crosby, Toru Uchikado","USA, Australia, UK",4 nominations.,54/100,54,6.8,"37,099",tt5814534,2020
The Gentlemen,The Gentlemen,2019,R,24 Jan 2020,113 min,"Action, Comedy, Crime",Guy Ritchie,"Matthew McConaughey, Charlie Hunnam, Michelle Dockery, Jeremy Strong","UK, USA",3 nominations.,51/100,51,7.8,"249,440",tt8367814,2020
Just Mercy,Just Mercy,2019,PG-13,10 Jan 2020,137 min,"Biography, Crime, Drama",Destin Daniel Cretton,"Jamie Foxx, Charlie Pye Jr., Michael Harding, Christopher Wolfe",USA,9 wins & 16 nominations.,85%,68,7.6,"48,673",tt4916630,2020
The Croods: A New Age,The Croods: A New Age,2020,PG,25 Nov 2020,95 min,"Animation, Adventure, Comedy, Family, Fantasy",Joel Crawford,"Nicolas Cage, Emma Stone, Ryan Reynolds, Catherine Keener",USA,Nominated for 1 Golden Globe. Another 25 nominations.,77%,56,7.0,"20,408",tt2850386,2020
Parasite,Parasite,2019,R,08 Nov 2019,132 min,"Comedy, Drama, Thriller",Bong Joon Ho,"Kang-ho Song, Sun-kyun Lee, Yeo-jeong Cho, Woo-sik Choi",South Korea,Won 4 Oscars. Another 297 wins & 265 nominations.,98%,96,8.6,"580,433",tt6751668,2020
Fantasy Island,Fantasy Island,2020,PG-13,14 Feb 2020,109 min,"Action, Adventure, Fantasy, Horror, Mystery, Thriller",Jeff Wadlow,"Michael Peña, Maggie Q, Lucy Hale, Austin Stowell",USA,5 nominations.,7%,22,4.9,"38,096",tt0983946,2020
Uncut Gems,Uncut Gems,2019,R,25 Dec 2019,135 min,"Crime, Drama, Thriller","Benny Safdie, Josh Safdie","Mesfin Lamengo, Sun Zhi Hua-Hilton, Liang Wei-Hui-Duncan, Sunny Wu Jin Zahao",USA,23 wins & 87 nominations.,91%,91,7.4,"226,863",tt5727208,2020
The New Mutants,The New Mutants,2020,PG-13,28 Aug 2020,94 min,"Action, Horror, Sci-Fi",Josh Boone,"Maisie Williams, Anya Taylor-Joy, Charlie Heaton, Alice Braga",USA,7 nominations.,35%,43,5.3,"46,440",tt4682266,2020
Like a Boss,Like a Boss,2020,R,10 Jan 2020,83 min,Comedy,Miguel Arteta,"Tiffany Haddish, Rose Byrne, Salma Hayek, Karan Soni",USA,1 win & 5 nominations.,33/100,33,4.6,"10,681",tt7545266,2020
The Grudge,The Grudge,2004,PG-13,22 Oct 2004,91 min,"Horror, Mystery, Thriller",Takashi Shimizu,"Sarah Michelle Gellar, Jason Behr, William Mapother, Clea DuVall","USA, Japan",2 wins & 10 nominations.,40%,49,5.9,"139,190",tt0391198,2020
Unhinged,Unhinged,2020,R,21 Aug 2020,90 min,"Action, Thriller",Derrick Borte,"Russell Crowe, Caren Pistorius, Gabriel Bateman, Jimmi Simpson","USA, UK",1 nomination.,40/100,40,6.0,"37,476",tt10059518,2020
The Photograph,The Photograph,2020,PG-13,14 Feb 2020,106 min,"Drama, Romance",Stella Meghie,"Issa Rae, LaKeith Stanfield, Chanté Adams, Y'lan Noel","USA, China",3 nominations.,62/100,62,6.0,"4,036",tt7798646,2020
The War with Grandpa,The War with Grandpa,2020,PG,09 Oct 2020,94 min,"Comedy, Drama, Family",Tim Hill,"Robert De Niro, Uma Thurman, Rob Riggle, Oakes Fegley","USA, UK, Canada",1 win.,30%,34,5.6,"12,230",tt4532038,2020
Underwater,Underwater,2020,PG-13,10 Jan 2020,95 min,"Action, Horror, Sci-Fi, Thriller",William Eubank,"Kristen Stewart, Vincent Cassel, Mamoudou Athie, T.J. Miller",USA,1 win & 3 nominations.,48/100,48,5.8,"64,980",tt5774060,2020
Wonder Woman 1984,Wonder Woman 1984,2020,PG-13,25 Dec 2020,151 min,"Action, Adventure, Fantasy",Patty Jenkins,"Gal Gadot, Chris Pine, Kristen Wiig, Pedro Pascal","USA, UK, Spain",5 wins & 32 nominations.,59%,60,5.4,"170,592",tt7126948,2020
The Turning,The Turning,2020,PG-13,24 Jan 2020,94 min,"Drama, Horror, Mystery",Floria Sigismondi,"Mackenzie Davis, Finn Wolfhard, Brooklynn Prince, Barbara Marten","UK, Ireland, India, Canada, USA",N/A,13%,35,3.8,"9,988",tt7510346,2020
Gretel & Hansel,Gretel,2010,N/A,N/A,12 min,"Short, Fantasy",Taylor Trikilis,"Lloyd Johnson, Stephanie Jones, Derrel Maury",USA,1 win.,NaN,N/A,N/A,N/A,tt1381584,2020
Honest Thief,Honest Thief,2020,PG-13,16 Oct 2020,99 min,"Action, Crime, Drama, Thriller",Mark Williams,"Liam Neeson, Kate Walsh, Jai Courtney, Jeffrey Donovan",USA,1 nomination.,46/100,46,6.0,"26,440",tt1838556,2020
My Hero Academia: Heroes Rising,My Hero Academia: Heroes Rising,2019,PG-13,26 Feb 2020,104 min,"Animation, Action, Adventure, Comedy, Sci-Fi",Kenji Nagasaki,"Daiki Yamashita, Nobuhiko Okamoto, Yuka Terasaki, Tomoyo Kurosawa",Japan,N/A,70/100,70,7.9,"3,979",tt11107074,2020
Bombshell,Bombshell,2019,R,20 Dec 2019,109 min,"Biography, Drama",Jay Roach,"Charlize Theron, Nicole Kidman, Margot Robbie, John Lithgow","Canada, USA",Won 1 Oscar. Another 24 wins & 59 nominations.,64/100,64,6.8,"93,603",tt6394270,2020
The Way Back,The Way Back,2010,PG-13,21 Jan 2011,133 min,"Adventure, Drama, History",Peter Weir,"Dragos Bucur, Colin Farrell, Ed Harris, Alexandru Potocean","USA, United Arab Emirates, Poland, India",Nominated for 1 Oscar. Another 4 wins & 4 nominations.,74%,66,7.3,"111,128",tt1023114,2020
Brahms: The Boy II,Brahms: The Boy II,2020,PG-13,21 Feb 2020,86 min,"Drama, Horror, Mystery, Thriller",William Brent Bell,"Katie Holmes, Christopher Convery, Owain Yeoman, Ralph Ineson","USA, China, Canada, Australia",1 nomination.,10%,29,4.6,"12,483",tt9173418,2020
Jojo Rabbit,Jojo Rabbit,2019,PG-13,08 Nov 2019,108 min,"Comedy, Drama, War",Taika Waititi,"Roman Griffin Davis, Thomasin McKenzie, Scarlett Johansson, Taika Waititi","New Zealand, Czech Republic, USA",Won 1 Oscar. Another 43 wins & 189 nominations.,80%,58,7.9,"306,456",tt2584384,2020
Impractical Jokers: The Movie,Impractical Jokers: The Movie,2020,PG-13,28 Feb 2020,92 min,Comedy,Chris Henchy,"Paula Abdul, Joe Gatto, James Murray, Brian Quinn",USA,N/A,39/100,39,5.9,"5,026",tt9208444,2020
Ford v Ferrari,Ford v Ferrari,2019,PG-13,15 Nov 2019,152 min,"Action, Biography, Drama, Sport",James Mangold,"Matt Damon, Christian Bale, Jon Bernthal, Caitriona Balfe",USA,Won 2 Oscars. Another 22 wins & 87 nominations.,92%,81,8.1,"300,533",tt1950186,2020
Emma.,Emma.,2020,PG,06 Mar 2020,124 min,"Comedy, Drama, Romance",Autumn de Wilde,"Anya Taylor-Joy, Angus Imrie, Letty Thomas, Gemma Whelan",UK,Nominated for 2 Oscars. Another 10 wins & 52 nominations.,71/100,71,6.7,"33,459",tt9214832,2020
Bloodshot,Bloodshot,2020,PG-13,13 Mar 2020,109 min,"Action, Drama, Sci-Fi",Dave Wilson,"Vin Diesel, Eiza González, Sam Heughan, Toby Kebbell",USA,1 win & 7 nominations.,44/100,44,5.7,"62,561",tt1634106,2020
I Still Believe,I Still Believe,2020,PG,13 Mar 2020,116 min,"Biography, Drama, Music, Romance","Andrew Erwin, Jon Erwin","K.J. Apa, Britt Robertson, Nathan Parsons, Gary Sinise",USA,2 nominations.,41/100,41,6.5,"8,622",tt9779516,2020
Come Play,Come Play,2020,PG-13,30 Oct 2020,96 min,"Drama, Horror, Mystery, Thriller",Jacob Chase,"Azhy Robertson, Gillian Jacobs, John Gallagher Jr., Winslow Fegley",USA,N/A,58/100,58,5.7,"7,995",tt8004664,2020
Let Him Go,Let Him Go,2020,R,06 Nov 2020,113 min,"Crime, Drama, Thriller",Thomas Bezucha,"Diane Lane, Kevin Costner, Kayli Carter, Ryan Bruce",USA,2 nominations.,63/100,63,6.7,"11,966",tt9340860,2020
Freaky,Freaky,2020,R,13 Nov 2020,102 min,"Comedy, Horror, Thriller",Christopher Landon,"Vince Vaughn, Kathryn Newton, Celeste O'Connor, Misha Osherovich",USA,1 win & 12 nominations.,66/100,66,6.3,"27,184",tt10919380,2020
Downhill,Downhill,2020,R,14 Feb 2020,86 min,"Comedy, Drama","Nat Faxon, Jim Rash","Julia Louis-Dreyfus, Will Ferrell, Zach Woods, Zoe Chao",USA,1 win & 1 nomination.,49/100,49,4.9,"9,791",tt4558376,2020
Weathering with You,Weathering with You,2019,PG-13,17 Jan 2020,112 min,"Animation, Drama, Fantasy, Romance",Makoto Shinkai,"Kotaro Daigo, Nana Mori, Shun Oguri, Sei Hiraizumi","Japan, China, USA",6 wins & 16 nominations.,72/100,72,7.5,"24,336",tt9426210,2020
Cats,Cats,2019,PG,20 Dec 2019,110 min,"Comedy, Drama, Family, Fantasy, Musical",Tom Hooper,"Robbie Fairchild, Mette Towley, Daniela Norman, Jaih Betote","UK, USA",Nominated for 1 Golden Globe. Another 11 wins & 6 nominations.,32/100,32,2.7,"43,199",tt5697572,2020
The Hunt,The Hunt,2012,R,10 Jan 2013,115 min,Drama,Thomas Vinterberg,"Mads Mikkelsen, Thomas Bo Larsen, Annika Wedderkopp, Lasse Fogelstrøm","Denmark, Sweden",Nominated for 1 Oscar. Another 37 wins & 69 nominations.,93%,77,8.3,"285,821",tt2106476,2020
The Rhythm Section,The Rhythm Section,2020,R,31 Jan 2020,109 min,"Action, Drama, Mystery, Thriller",Reed Morano,"Blake Lively, Richard Brake, Elly Curtis, David Duggan","UK, Spain, Ireland, USA",1 win & 3 nominations.,28%,45,5.3,"13,203",tt7134096,2020
Monster Hunter,Monster Hunter,2020,PG-13,18 Dec 2020,103 min,"Action, Adventure, Fantasy",Paul W.S. Anderson,"Milla Jovovich, Tony Jaa, Ron Perlman, T.I.","Germany, USA, Japan, South Africa",2 nominations.,45/100,45,5.3,"27,224",tt6475714,2020
A Beautiful Day in the Neighborhood,A Beautiful Day in the Neighborhood,2019,PG,22 Nov 2019,109 min,"Biography, Drama",Marielle Heller,"Tom Hanks, Matthew Rhys, Chris Cooper, Susan Kelechi Watson","China, USA",Nominated for 1 Oscar. Another 6 wins & 63 nominations.,80/100,80,7.3,"63,372",tt3224458,2020
Richard Jewell,Richard Jewell,2019,R,13 Dec 2019,131 min,"Biography, Crime, Drama",Clint Eastwood,"Paul Walter Hauser, Sam Rockwell, Brandon Stanley, Ryan Boz",USA,Nominated for 1 Oscar. Another 7 wins & 18 nominations.,68/100,68,7.5,"66,087",tt3513548,2020
The SpongeBob Movie: Sponge on the Run,The SpongeBob Movie: Sponge on the Run,2020,PG,04 Mar 2021,91 min,"Animation, Adventure, Comedy, Family",Tim Hill,"Tim Hill, Clancy Brown, Bill Fagerbakke, Rodger Bumpass","USA, South Korea, Mexico, Japan, Spain",1 nomination.,67%,65,6.0,"11,763",tt4823776,2020
The Broken Hearts Gallery,The Broken Hearts Gallery,2020,PG-13,11 Sep 2020,109 min,"Comedy, Romance",Natalie Krinsky,"Geraldine Viswanathan, Dacre Montgomery, Utkarsh Ambudkar, Molly Gordon","USA, Canada",1 nomination.,57/100,57,6.2,"4,162",tt2140571,2020
Infidel,Infidel,2019,R,18 Sep 2020,108 min,"Action, Adventure, Thriller",Cyrus Nowrasteh,"Jim Caviezel, Claudia Karvan, Hal Ozsan, Stelio Savante",USA,N/A,NaN,N/A,5.9,"2,135",tt11229780,2020
News of the World,News of the World,2020,PG-13,25 Dec 2020,118 min,"Action, Adventure, Drama, Western",Paul Greengrass,"Tom Hanks, Helena Zengel, Tom Astor, Travis Johnson","USA, China",Nominated for 4 Oscars. Another 4 wins & 70 nominations.,73/100,73,6.8,"48,485",tt6878306,2020
Portrait of a Lady on Fire,Portrait of a Lady on Fire,2019,R,14 Feb 2020,122 min,"Drama, Romance",Céline Sciamma,"Noémie Merlant, Adèle Haenel, Luàna Bajrami, Valeria Golino",France,Nominated for 1 Golden Globe. Another 49 wins & 151 nominations.,95/100,95,8.1,"66,991",tt8613070,2020
Bill & Ted Face the Music,Bill,2015,PG,18 Sep 2015,94 min,"Comedy, Family, History",Richard Bracewell,"Mathew Baynton, Simon Farnaby, Martha Howe-Douglas, Jim Howick",UK,N/A,89%,60,6.5,"2,080",tt2978576,2020
2020 Oscar Nominated Short Films,2020 Oscar Nominated Short Films: Live Action,2020,Not Rated,31 Jan 2020,104 min,"Drama, Reality-TV",N/A,N/A,N/A,N/A,NaN,N/A,7.5,80,tt11696978,2020
Queen & Slim,Queen,2013,Not Rated,07 Mar 2014,146 min,"Adventure, Comedy, Drama",Vikas Bahl,"Kangana Ranaut, Rajkummar Rao, Lisa Haydon, Jeffrey Ho",India,22 wins & 18 nominations.,90%,N/A,8.2,"60,975",tt3322420,2020
The Empty Man,The Empty Man,2020,R,23 Oct 2020,137 min,"Crime, Drama, Horror, Mystery, Thriller",David Prior,"James Badge Dale, Marin Ireland, Sasha Frolova, Samantha Logan","USA, South Africa, UK",1 nomination.,NaN,N/A,5.7,"5,150",tt5867314,2020
My Boyfriend's Meds,My Boyfriend's Meds,2020,R,21 Feb 2020,100 min,Comedy,Diego Kaplan,"Marco Antonio Aguirre, Jason Alexander, Pamela Almanza, Luis Arrieta",Mexico,3 nominations.,NaN,N/A,4.4,347,tt8976664,2020
The Last Full Measure,The Last Full Measure,2019,R,24 Jan 2020,116 min,"Drama, War",Todd Robinson,"Sebastian Stan, Alison Sudol, Asher Miles Fallica, LisaGay Hamilton",USA,1 nomination.,60%,51,6.8,"8,277",tt0783640,2020
Words on Bathroom Walls,Words on Bathroom Walls,2020,PG-13,21 Aug 2020,110 min,"Drama, Romance",Thor Freudenthal,"Charlie Plummer, Andy Garcia, Taylor Russell, AnnaSophia Robb",USA,N/A,61/100,61,7.0,"3,207",tt8045906,2020
Fatale,Fatale,2020,R,18 Dec 2020,102 min,Thriller,Deon Taylor,"Hilary Swank, Michael Ealy, Mike Colter, Damaris Lewis",USA,N/A,42/100,42,5.3,"4,039",tt8829830,2020
Ip Man 4: The Finale,Ip Man 4: The Finale,2019,Not Rated,20 Dec 2019,107 min,"Action, Biography, Drama, History",Wilson Yip,"Donnie Yen, Scott Adkins, Danny Kwok-Kwan Chan, Vanness Wu","Hong Kong, China",12 wins & 10 nominations.,84%,62,7.0,"25,250",tt2076298,2020
Half Brothers,Half Brothers,2020,PG-13,04 Dec 2020,96 min,"Comedy, Drama",Luke Greenfield,"Luis Gerardo Méndez, José Zúñiga, Vincent Spano, Connor Del Rio","Mexico, USA",N/A,30/100,30,6.0,943,tt10515926,2020
The Personal History of David Copperfield,The Personal History of David Copperfield,2019,PG,28 Aug 2020,119 min,"Comedy, Drama",Armando Iannucci,"Fisayo Akinade, Nikki Amuka-Bird, Albie Atkinson, Aneurin Barnard","UK, USA",Nominated for 1 Golden Globe. Another 15 wins & 29 nominations.,77/100,77,6.4,"14,283",tt6439020,2020
The Wretched,The Wretched,2019,Not Rated,01 May 2020,95 min,"Horror, Mystery","Brett Pierce, Drew T. Pierce","John-Paul Howard, Piper Curda, Jamison Jones, Azie Tesfai",USA,4 wins & 4 nominations.,75%,61,5.8,"11,353",tt8305806,2020
The Lodge,The Lodge,2019,R,16 Jan 2020,108 min,"Drama, Horror, Thriller","Severin Fiala, Veronika Franz","Riley Keough, Jaeden Martell, Lia McHugh, Richard Armitage","UK, USA, Canada",2 wins & 11 nominations.,74%,64,6.1,"33,594",tt7347846,2020
Joker,Joker,2019,R,04 Oct 2019,122 min,"Crime, Drama, Thriller",Todd Phillips,"Joaquin Phoenix, Robert De Niro, Zazie Beetz, Frances Conroy","USA, Canada",Won 2 Oscars. Another 112 wins & 234 nominations.,68%,59,8.4,"968,325",tt7286456,2020
The Rental,The Rental,2020,R,24 Jul 2020,88 min,"Drama, Horror, Mystery, Thriller",Dave Franco,"Dan Stevens, Alison Brie, Sheila Vand, Jeremy Allen White",USA,5 nominations.,62/100,62,5.7,"19,709",tt10003008,2020
Once Upon a Time... In Hollywood,Once Upon a Time... In Hollywood,2019,R,26 Jul 2019,161 min,"Comedy, Drama",Quentin Tarantino,"Leonardo DiCaprio, Brad Pitt, Margot Robbie, Emile Hirsch","USA, UK, China",Won 2 Oscars. Another 134 wins & 372 nominations.,85%,83,7.6,"563,506",tt7131622,2020
2 Hearts,2 Hearts,2020,PG-13,16 Oct 2020,101 min,"Drama, Romance",Lance Hool,"Radha Mitchell, Jacob Elordi, Adan Canto, Tahmoh Penikett",USA,N/A,29/100,29,5.7,507,tt5616176,2020
Promising Young Woman,Promising Young Woman,2020,R,25 Dec 2020,113 min,"Crime, Drama, Thriller",Emerald Fennell,"Adam Brody, Ray Nicholson, Sam Richardson, Carey Mulligan","UK, USA",Nominated for 5 Oscars. Another 83 wins & 166 nominations.,72/100,72,7.5,"47,359",tt9620292,2020
True to the Game 2,True to the Game 2,2020,R,06 Nov 2020,94 min,Thriller,Jamal Hill,"Vivica A. Fox, Andra Fuller, Rotimi, Erica Peeples",USA,N/A,NaN,N/A,3.6,191,tt11237714,2020
Train to Busan Presents: Peninsula,Train to Busan Presents: Peninsula,2020,Not Rated,07 Aug 2020,116 min,"Action, Horror, Thriller",Sang-ho Yeon,"Dong-won Gang, Lee Jung-hyun, Re Lee, Hae-hyo Kwon",South Korea,6 wins & 11 nominations.,51/100,51,5.5,"21,166",tt8850222,2020
The Assistant,The Assistant,2019,R,31 Jan 2020,87 min,Drama,Kitty Green,"Julia Garner, Owen Holland, Jon Orsini, Rory Kulz",USA,5 wins & 21 nominations.,79/100,79,6.3,"15,935",tt9000224,2020
Love and Monsters,Love and Monsters,2020,PG-13,16 Oct 2020,109 min,"Action, Adventure, Comedy, Fantasy, Sci-Fi",Michael Matthews,"Dylan O'Brien, Jessica Henwick, Michael Rooker, Dan Ewing","Canada, USA",Nominated for 1 Oscar. Another 3 nominations.,59/100,59,7.0,"34,459",tt2222042,2020
Relic,Relic,2020,R,10 Jul 2020,89 min,"Drama, Horror, Mystery, Thriller",Natalie Erika James,"Robyn Nevin, Emily Mortimer, Bella Heathcote, Steve Rodgers","Australia, USA",5 wins & 21 nominations.,77/100,77,6.0,"17,059",tt9072352,2020
The Tax Collector,The Tax Collector,2020,Not Rated,07 Aug 2020,95 min,"Action, Crime, Drama, Thriller",David Ayer,"Bobby Soto, Cinthya Carmona, Shia LaBeouf, Jose Conejo Martin",USA,1 nomination.,22/100,22,4.8,"9,429",tt8461224,2020
The Last Shift,The Last Shift,2020,R,25 Sep 2020,90 min,"Comedy, Drama",Andrew Cohn,"Richard Jenkins, Holden Ochsenhirt, Da'Vine Joy Randolph, Ed O'Neill",USA,1 win & 1 nomination.,61/100,61,5.6,985,tt10661180,2020
Becky,Becky,2020,R,05 Jun 2020,93 min,"Action, Crime, Drama, Horror, Thriller","Jonathan Milott, Cary Murnion","Lulu Wilson, Kevin James, Joel McHale, Robert Maillet",USA,1 nomination.,54/100,54,5.8,"11,673",tt10314450,2020
The Song of Names,The Song of Names,2019,PG-13,25 Dec 2019,113 min,"Drama, Music, Mystery, War",François Girard,"Eddie Izzard, Gerran Howell, Stanley Townsend, Amy Sloan","Canada, Hungary, UK, Germany",6 wins & 9 nominations.,51/100,51,6.4,"2,736",tt1657517,2020
All My Life,All My Life,2008,Not Rated,22 Jun 2008,119 min,"Drama, Romance",Maher Sabry,"Seham Saneya Adelsalam, Mehammed Amadeus, Janaan Attia, Ayman","Egypt, France, Israel, Lebanon",N/A,NaN,N/A,5.8,"2,297",tt1334617,2020
Mafia Inc,Mafia Inc,2019,N/A,25 Aug 2020,143 min,"Crime, Drama",Daniel Grou,"Sergio Castellitto, Marc-André Grondin, Gilbert Sicotte, Mylène Mackay",Canada,2 wins & 8 nominations.,64/100,64,7.0,729,tt6980960,2020
Jay and Silent Bob Reboot,Jay and Silent Bob Reboot,2019,R,29 Nov 2019,105 min,"Adventure, Comedy",Kevin Smith,"Joey Lauren Adams, Ben Affleck, Fred Armisen, Diedrich Bader",USA,1 nomination.,46/100,46,5.7,"20,143",tt6521876,2020
A Hidden Life,A Hidden Life,2019,PG-13,17 Jan 2020,174 min,"Biography, Drama, Romance, War",Terrence Malick,"August Diehl, Valerie Pachner, Maria Simon, Karin Neuhäuser","USA, UK, Germany",9 wins & 30 nominations.,81%,78,7.4,"19,103",tt5827916,2020
Cut Throat City,Cut Throat City,2020,R,21 Aug 2020,123 min,"Action, Crime, Drama, Thriller",RZA,"Shameik Moore, Demetrius Shipp Jr., Denzel Whitaker, Keean Johnson",USA,N/A,67/100,67,4.9,"1,584",tt3547306,2020
Sarileru Neekevvaru,Sarileru Neekevvaru,2020,Not Rated,10 Jan 2020,169 min,"Action, Comedy, Drama",Anil Ravipudi,"Mahesh Babu, Rashmika Mandanna, Vijayshanti, Prakash Raj",India,N/A,NaN,N/A,6.0,"5,364",tt10773090,2020
Vanguard,Vanguard,2020,PG-13,20 Nov 2020,107 min,"Action, Adventure, Comedy, Thriller",Stanley Tong,"Jackie Chan, Yang Yang, Lun Ai, Miya Muqi",China,1 win & 1 nomination.,34/100,34,4.7,"3,126",tt9695722,2020
Shortcut,Shortcut,2020,R,25 Sep 2020,80 min,"Adventure, Fantasy, Horror",Alessio Liguori,"Jack Kane, Zander Emlano, Zak Sutcliffe, Sophie Jane Oliver","Italy, Germany",N/A,26/100,26,3.9,617,tt8960138,2020
